{
  "schema_version": 1,
  "manifest_id": "Operation-FileOperate-Settings-001-gold-draft-v1",
  "manifest_role": "gold",
  "draft_status": "integrity_unverified",
  "distribution_policy": "download_only",
  "task_id": "Operation-FileOperate-Settings-001",
  "task_uid": "9b5220d5-f1f0-4db9-902d-ad41aae4d775",
  "source_task_id": "47f7c0ce-a5fb-4100-a5e6-65cd0e7429e5",
  "source_evaluator_id": "9b5220d5-f1f0-4db9-902d-ad41aae4d775",
  "source_contract_sha256": "5f3ebcf626c74ac25b31c54c186166064c8a62edec23a87efbf1655a854ff66d",
  "source": {
    "provider": "huggingface_dataset",
    "repository": "xlangai/ubuntu_osworld_file_cache",
    "revision": "711e0811642364e7aa8f10a8918367d0b626d578"
  },
  "license": {
    "status": "verified",
    "spdx_expression": "Apache-2.0",
    "evidence_ref": "https://huggingface.co/datasets/xlangai/ubuntu_osworld_file_cache",
    "distribution": "download_only"
  },
  "entries": [
    {
      "logical_key": "osworld-gold:47f7c0ce-a5fb-4100-a5e6-65cd0e7429e5:expected:0:v1",
      "expected_index": 0,
      "remote_relative_path": "multi_apps/47f7c0ce-a5fb-4100-a5e6-65cd0e7429e5/landscape.png",
      "path_status": "verified",
      "path_evidence_ref": "osworld:evaluator:9b5220d5-f1f0-4db9-902d-ad41aae4d775:expected:0",
      "purpose": "evaluator_gold",
      "expected_media_type": "image/png",
      "integrity": {
        "status": "unverified",
        "size_bytes": null,
        "sha256": null,
        "evidence_ref": null
      }
    }
  ]
}
