{
  "schema_version": 1,
  "manifest_id": "Operation-FileOperate-CombinationDocs-014-gold-draft-v1",
  "manifest_role": "gold",
  "draft_status": "integrity_verified",
  "distribution_policy": "download_only",
  "task_id": "Operation-FileOperate-CombinationDocs-014",
  "task_uid": "f5e1b40b-ea38-4d9f-9cf6-11f1dff5f2cc",
  "source_task_id": "881deb30-9549-4583-a841-8270c65f2a17",
  "source_evaluator_id": "881deb30-9549-4583-a841-8270c65f2a17",
  "source_contract_sha256": "f8bb09a70d6733f65bbe1e03e6d8c7a7366671cff70bf688450bba34fbcd809d",
  "source": {
    "provider": "huggingface_dataset",
    "repository": "xlangai/ubuntu_osworld_file_cache",
    "revision": "711e0811642364e7aa8f10a8918367d0b626d578"
  },
  "license": {
    "status": "verified",
    "spdx_expression": "Apache-2.0",
    "evidence_ref": "https://huggingface.co/datasets/xlangai/ubuntu_osworld_file_cache",
    "distribution": "download_only"
  },
  "entries": [
    {
      "logical_key": "osworld-gold:881deb30-9549-4583-a841-8270c65f2a17:expected:0:v1",
      "expected_index": 0,
      "remote_relative_path": "multi_apps/881deb30-9549-4583-a841-8270c65f2a17/supported_rate_gt.xlsx",
      "path_status": "verified",
      "path_evidence_ref": "osworld:evaluator:881deb30-9549-4583-a841-8270c65f2a17:expected:0",
      "purpose": "evaluator_gold",
      "expected_media_type": "application/vnd.openxmlformats-officedocument.spreadsheetml.sheet",
      "integrity": {
        "status": "verified",
        "size_bytes": 6562,
        "sha256": "9d97b986f83c1871831933499ff69de7198d99b3be0b9347ef8ab1559073fca0",
        "evidence_ref": "https://huggingface.co/datasets/xlangai/ubuntu_osworld_file_cache/resolve/711e0811642364e7aa8f10a8918367d0b626d578/multi_apps/881deb30-9549-4583-a841-8270c65f2a17/supported_rate_gt.xlsx"
      }
    },
    {
      "logical_key": "osworld-gold:881deb30-9549-4583-a841-8270c65f2a17:expected:1:v1",
      "expected_index": 1,
      "remote_relative_path": "multi_apps/881deb30-9549-4583-a841-8270c65f2a17/supported_rate_gt.csv",
      "path_status": "verified",
      "path_evidence_ref": "osworld:evaluator:881deb30-9549-4583-a841-8270c65f2a17:expected:1",
      "purpose": "evaluator_gold",
      "expected_media_type": "text/csv",
      "integrity": {
        "status": "verified",
        "size_bytes": 593,
        "sha256": "c238cedb3a42969b98b7e17a0901925d93a60631d30d8786b6e53a1cef1c09bc",
        "evidence_ref": "https://huggingface.co/datasets/xlangai/ubuntu_osworld_file_cache/resolve/711e0811642364e7aa8f10a8918367d0b626d578/multi_apps/881deb30-9549-4583-a841-8270c65f2a17/supported_rate_gt.csv"
      }
    }
  ]
}
