{
  "schema_version": 1,
  "manifest_id": "Operation-FileOperate-SearchAndWrite-001-gold-draft-v1",
  "manifest_role": "gold",
  "draft_status": "integrity_verified",
  "distribution_policy": "download_only",
  "task_id": "Operation-FileOperate-SearchAndWrite-001",
  "task_uid": "e9e7bcf6-92da-4ff0-aaea-821099370093",
  "source_task_id": "c7c1e4c3-9e92-4eba-a4b8-689953975ea4",
  "source_evaluator_id": "e9e7bcf6-92da-4ff0-aaea-821099370093",
  "source_contract_sha256": "8ff91da03ef3013c0abe4bac318a6c9ddaa5a6271cf6ed4652ffe7f8b6f73539",
  "source": {
    "provider": "huggingface_dataset",
    "repository": "xlangai/ubuntu_osworld_file_cache",
    "revision": "711e0811642364e7aa8f10a8918367d0b626d578"
  },
  "license": {
    "status": "verified",
    "spdx_expression": "Apache-2.0",
    "evidence_ref": "https://huggingface.co/datasets/xlangai/ubuntu_osworld_file_cache",
    "distribution": "download_only"
  },
  "entries": [
    {
      "logical_key": "osworld-gold:c7c1e4c3-9e92-4eba-a4b8-689953975ea4:expected:0:v1",
      "expected_index": 0,
      "remote_relative_path": "multi_apps/c7c1e4c3-9e92-4eba-a4b8-689953975ea4/Professor_Contact_Gold.xlsx",
      "path_status": "verified",
      "path_evidence_ref": "osworld:evaluator:e9e7bcf6-92da-4ff0-aaea-821099370093:expected:0",
      "purpose": "evaluator_gold",
      "expected_media_type": "application/vnd.openxmlformats-officedocument.spreadsheetml.sheet",
      "integrity": {
        "status": "verified",
        "size_bytes": 5794,
        "sha256": "2e30e2af19a57982b7f0e5c077ccc256b39e49d9c923bc53c4fdbb1ea0b31dc5",
        "evidence_ref": "https://huggingface.co/datasets/xlangai/ubuntu_osworld_file_cache/resolve/711e0811642364e7aa8f10a8918367d0b626d578/multi_apps/c7c1e4c3-9e92-4eba-a4b8-689953975ea4/Professor_Contact_Gold.xlsx"
      }
    }
  ]
}
